{
  "task": {
    "task_id": "PAY-042",
    "run_id": "RUN-042",
    "kind": "payment-api-test",
    "resource": "repo:payments-api/tests",
    "contract_sha256": "94f1a99fcd8161f26dcdf20d92ddf3088ba6100f8d005098669e95ac2cc22b73",
    "context_refs": [
      "approved-contract.txt@94f1a99fcd8161f26dcdf20d92ddf3088ba6100f8d005098669e95ac2cc22b73"
    ],
    "deadline": "2026-09-06T12:05:00Z",
    "budget_usd": 2,
    "configuration": "payments-testgen@1.3.0"
  },
  "policy": {
    "decision_id": "DEC-042",
    "task_id": "PAY-042",
    "run_id": "RUN-042",
    "identity": "qe-payments-sandbox",
    "policy_version": "7",
    "decision": "allow",
    "action": "sandbox.test",
    "resource": "repo:payments-api/tests",
    "issued_at": "2026-09-06T12:00:00Z",
    "expires_at": "2026-09-06T12:00:30Z",
    "idempotency_key": "RUN-042:sandbox.test:1"
  },
  "evaluation": {
    "evaluation_id": "EVAL-042",
    "task_id": "PAY-042",
    "run_id": "RUN-042",
    "artifact_sha256": "8920ad34245adc0c36376a6d656cadd7e9f73e4826cc101d47a30b7dd859ae2a",
    "contract_sha256": "94f1a99fcd8161f26dcdf20d92ddf3088ba6100f8d005098669e95ac2cc22b73",
    "configuration": "payments-testgen@1.3.0",
    "corpus": "payment-boundaries@3",
    "runner": "sandbox@4",
    "original_pass": true,
    "repeat_runs": 3,
    "mutant_killed": true,
    "security_pass": true
  },
  "evidence": {
    "record_id": "REC-042",
    "task_id": "PAY-042",
    "run_id": "RUN-042",
    "decision_id": "DEC-042",
    "evaluation_id": "EVAL-042",
    "artifact_sha256": "8920ad34245adc0c36376a6d656cadd7e9f73e4826cc101d47a30b7dd859ae2a",
    "durable_receipt": "receipt:REC-042",
    "status": "held-for-human-review",
    "reviewer": null
  },
  "request_time": "2026-09-06T12:00:10Z"
}
